{
  "$schema": "https://json-schema.org/draft/2020-12/schema",
  "$id": "https://tohseno.com/schemas/app-template-v1.json",
  "title": "TOHSENO bundled app template",
  "type": "object",
  "additionalProperties": false,
  "required": [
    "schemaVersion",
    "id",
    "version",
    "title",
    "summary",
    "platforms",
    "kernel",
    "skills",
    "agentInstructions",
    "definitionOfDone"
  ],
  "properties": {
    "schemaVersion": { "const": 1 },
    "id": { "type": "string", "pattern": "^[a-z0-9]+(?:-[a-z0-9]+)*$" },
    "version": { "type": "string", "pattern": "^[0-9]+\\.[0-9]+\\.[0-9]+$" },
    "title": { "type": "string", "minLength": 1 },
    "summary": { "type": "string", "minLength": 1 },
    "platforms": {
      "type": "array",
      "prefixItems": [{ "const": "ios" }],
      "items": false
    },
    "kernel": { "type": "string" },
    "skills": { "type": "array", "items": { "type": "string" } },
    "overlay": { "type": "string" },
    "replaces": { "type": "array", "items": { "type": "string" } },
    "agentInstructions": { "type": "array", "items": { "type": "string" } },
    "definitionOfDone": { "type": "array", "items": { "type": "string" } }
  }
}
